Search_Term,Post_compound,Comment_compound
Albanese social media ban,0.18267166666666668,0.252175
Australia digital ID law,0.15780000000000002,0.15669999999999998
Australia under 16 social media ban,0.36042125,0.40183
Online Safety Amendment Act 2024,0.23775555555555558,0.23894444444444446
Online Safety Commissioner Australia,-0.9151,0.3755
age verification social media Australia,0.3193055555555555,0.3530638888888889
do teens need social media,0.09955000000000003,-0.02194999999999997
kids off social media,0.4329,0.4406862068965517
let kids be kids campaign,0.936225,0.49998750000000003
online safety for teenagers,-0.0990222222222222,0.5631555555555555
parental controls on social media,0.3842,-0.11249999999999999
social media addiction teens Australia,-0.7141500000000001,-0.10980000000000001
social media age restriction Australia,0.2689361445783133,0.3293542168674699
social media harm to teens,-0.9953,-0.9883
young people and social media ban,0.19982277777777777,0.29668500000000003
